#document_id, title, author, url, date_submitted, comments
"PFS-ICS-PRU030000-05", "PFS ICS Hardware Configuration Report", "Hassan Siddiqui", "https://sumire.pbworks.com/w/file/fetch/128348475/PFS-ICS-PRU030000-05_PFS_ICS_Hardware_Configuration_Report.pdf", "2018-08-27",   
"PFS-ICS-PRU030000-04", "PFS ICS Hardware Configuration Report", "Hassan Siddiqui", "https://sumire.pbworks.com/w/file/fetch/128327124/PFS-ICS-PRU030000-04_PFS_ICS_Hardware_Configuration_Report.pdf", "2018-08-26",   
"PFS-ICS-PRU030000-03", "PFS ICS Hardware Configuration Report", "Hassan Siddiqui", "https://sumire.pbworks.com/w/file/fetch/127236176/PFS-ICS-PRU030000-03_PFS_ICS_Hardware_Configuration_Report.pdf", "2018-06-26",   
"PFS-ICS-PRU030001-01", "MCS Data flow for July 2018 tests", "Hassan Siddiqui", "https://sumire.pbworks.com/w/file/fetch/127014725/PFS-ICS-PRU030001-01_MCS_Data_Flow.pdf", "2018-06-14", 
"PFS-ICS-PRU030000-02", "PFS ICS Hardware Configuration Report", "Hassan Siddiqui", "https://sumire.pbworks.com/w/file/fetch/127009931/PFS-ICS-PRU030000-02_PFS_ICS_Hardware_Configuration_Report.pdf", "2018-06-13", 
"PFS-PFI-PRU040001-01", "Cobra Movement Test Report June 2018", "Erin Kado-Fong", "https://sumire.pbworks.com/w/file/fetch/126883949/PFS-PFI-PRU040001-01_CobraTests_June2018.pdf", "2018-06-08", 
"PFS-ICS-PRU030000-01", "PFS ICS Hardware Configuration Report", "Hassan Siddiqui", "https://sumire.pbworks.com/w/file/126994364/PFS-ICS-PRU030000-01_PFS_ICS_Hardware_Configuration_Report.pdf", "2018-05-07", 
"PFS-DRP-PRU050001-01", "Interim report on the status of 2D PSF modelling", "Neven Caplar", "https://sumire.pbworks.com/w/file/fetch/127999977/PFS-DRP-PRU050001-01_2D_modelling_status.pdf", "2018-06-26",
"PFS-PFI-PRU040002-01", "Cobra Tests Continuous Driving", "Erin Kado-Fong", "https://sumire.pbworks.com/w/file/128726046/PFS-PFI-PRU040002-01_cobratests_continuousdriving.pdf", "2018-09-11", 
"PFS-GEN-PRU000010-01", "Uploading Whitepaper HOWTO", "Jim Gunn", "https://sumire.pbworks.com/w/file/fetch/52513367/PFS-GEN-PRU000010-01_uploadingwhitepaperHOWTO.txt", "2011-01-01", "howto dummies"
"PFS-PFI-PRU000020-01", "Summary of Subaru/WFC Imaging Performance", "Jim Gunn", "https://sumire.pbworks.com/w/file/fetch/52500032/PFS-PFI-PRU000020-01_subarusummary1.txt", "2012-04-04", "Summary of Subaru/WFC imaging performance for PFS with vigetting, angles, etc."
"PFS-PFI-PRU000030-01", "Cobra field", "Jim Gunn", "https://sumire.pbworks.com/w/file/fetch/52500731/PFS-PFI-PRU000030-01_cobrafield.txt", "2012-04-04", "Summary of cobra geometry and field size on sky, using the optical information from PRU000020"
"PFS-PFI-PRU000040-01", "Notes on rotator and A&G cameras", "Jim Gunn", "https://sumire.pbworks.com/w/file/fetch/52512949/PFS-PFI-PRU000040-01_rotatorandfibers.pdf", "2011-12-03", "Notes on the rotator and A&G cameras and rotation limits"
"PFS-SPS-PRU000050-01", "Notes on geometry of fiber slit", "Jim Gunn", "https://sumire.pbworks.com/w/file/fetch/52512946/PFS-SPS-PRU000050-01_PFSFiberSlit.pdf", "2012-01-07", "Notes on the geometry of the fiber slit"
"PFS-SPS-PRU000060-01", "Notes on dither", "Jim Gunn", "https://sumire.pbworks.com/w/file/fetch/59624012/PFS-SPS-PRU000060-01_dither.pdf", "2012-05-17", "Notes on the requirements for the dither mechanism for the FSA"
"PFS-SPS-PRU000070-01", "Notes on aiming fibers", "Jim Gunn", "https://sumire.pbworks.com/w/file/fetch/58459168/PFS-SPS-PRU000070-01_aimingfibers.pdf", "2013-09-12", "Notes on aiming the fibers to create a fiber pupil in the right place (on the gratings) AND the detailed geometry for the PFS slit masks.  Latest version (130912) has *hopefully* correct detector geometry and new slit curvature. PLEASE discard ALL earlier versions."
"PFS-SPS-PRU000080-01", "Notes on the formation of ghosts by glass slit plate", "Jim Gunn", "https://sumire.pbworks.com/w/file/fetch/58481636/PFS-SPS-PRU000080-01_slitplateghosts.pdf", "2012-09-10", "Notes on the formation of ghosts by a glass slit plate"
"PFS-SPS-PRU000090-01", "Fiber In/Out", "Jim Gunn", "https://sumire.pbworks.com/w/file/fetch/57868546/PFS-SPS-PRU000090-01_fiberinout.pdf", "2012-08-22", "Notes on aiming the fibers to create a fiber pupil in the right place (on the gratings) AND the detailed geometry for the PFS slit masks.  Latest version (130912) has *hopefully* correct detector geometry and new slit curvature. PLEASE discard ALL earlier versions."
"PFS-FIB-PRU000100-01", "Fiber FRD", "Jim Gunn", "https://sumire.pbworks.com/w/file/fetch/60347914/PFS-FIB-PRU000100-01_fiberfrd.pdf", "2013-04-11", "Modelling the fiber FRD using the LNA experiments"
"PFS-FIB-PRU000110-01", "Fiber Routing", "Jim Gunn", "https://sumire.pbworks.com/w/file/fetch/60347952/PFS-FIB-PRU000110-01_fiberrouting.121002.pdf", "2012-10-02", "Suggestion for fiber routing with no crossovers."
"PFS-PFI-PRU000120-01", "PFS Focus", "Jim Gunn", "https://sumire.pbworks.com/w/file/fetch/61196318/PFS-PFI-PRU000120-01_pfsfocus.pdf", "2012-11-18", "A study on the location of the PFS focal plane with respect to the WFC, and a short study on guiding, focussing, and aquisition errors."
"PFS-SPS-PRU000130-01", "Crosstalk", "Jim Gunn", "https://sumire.pbworks.com/w/file/fetch/64667092/PFS-SPS-PRU000130-01_crosstalk.pdf", "2013-03-21", "A proposed definition of fiber-to-fiber crosstalk and a proposed specification"
"PFS-PFI-PRU000140-01", "WFC Errors", "Jim Gunn", "https://sumire.pbworks.com/w/file/fetch/65241357/PFS-PFI-PRU000140-01_wfcerrors2.txt", "2013-04-09", "A small study on the effect of the observed high-frequency slope errors in the WFC on Metrology Camera performance"
"PFS-GEN-PRU000150-01", "Back Illumination", "Jim Gunn", "https://sumire.pbworks.com/w/file/fetch/65433431/PFS-GEN-PRU000150-01_backillumination.pdf", "2013-04-16", "A small study on what illumination level is needed for the fiber back-illumination."
"PFS-SPS-PRU000160-01", "Slit and Detectors", "Jim Gunn", "https://sumire.pbworks.com/w/file/fetch/66092555/PFS-SPS-PRU000160-01_slitanddetectors.pdf", "2013-09-11", "A document detailing the layout of the fibers along the fiber slit. Use in conjuction with the fiber routing white paper, which defines most of the nomenclature. This uses the detector geometry to define the slit geometry propagated to the newest version of the fiber aiming paper. (revised 130911 to include the medium resolution mode footprints and the new slit curvature value (.00151/mm))."
"PFS-SPS-PRU000170-01", "Slit Curvature", "Jim Gunn", "https://sumire.pbworks.com/w/file/fetch/68099253/PFS-SPS-PRU000170-01_slitcurvature.pdf", "2013-08-07", "A small study on the effects of slit curvature on image performance metrics in the presence of FRD"
"PFS-SPS-PRU000180-01", "Cooling IR4", "Jim Gunn", "https://sumire.pbworks.com/w/file/fetch/86372539/PFS-SPS-PRU000180-01_coolingIR4.pdf", "2014-09-26", "A study of cooling requirements for the SCR and spectrograph modules, and a proposed plumbing layout"
"PFS-PFI-PRU000190-01", "Calibration Design", "Jim Gunn", "https://sumire.pbworks.com/w/file/fetch/87520753/PFS-PFI-PRU000190-01_calibrationdesign.pdf", "2014-10-15", "A very preliminary  document describing the calibration system mounted on top of the PFI"
"PFS-PFI-PRU000200-01", "AG Focus", "Jim Gunn", "https://sumire.pbworks.com/w/file/fetch/61196318/PFS-PFI-PRU000120-01_pfsfocus.pdf", "2015-05-18", "Study of AG camera depth, number of stars, and focus servo"
"PFS-SPS-PRU000210-01", "Slit 2 FRD", "Jim Gunn", "https://sumire.pbworks.com/w/file/fetch/103612533/PFS-SPS-PRU000210-01_slit2frd.pdf", "2015-12-07", "Evaluation of LNA Slit 2 performance (without cover plate)"
"PFS-FIB-PRU000220-01", "Fiber Connectors", "Jim Gunn", "https://sumire.pbworks.com/w/file/fetch/106603992/PFS-FIB-PRU000220-01_fiberconnectors.pdf", "2016-03-28", "Study of elastic properties of mating MTP multifiber connectors"
"PFS-SPS-PRU000230-01", "IR Thermal Background", "Jim Gunn", "https://sumire.pbworks.com/w/file/fetch/121679646/PFS-SPS-PRU000230-01_irthermalbackground_JGunn_170802.pdf", "2017-08-02", "The Thermal Background in the PFS IR Dewar"
"PFS-FIB-PRU000240-01", "COBRA and FIDUCIAL Coordinates and Numbering Scheme", "Jim Gunn", "https://sumire.pbworks.com/w/file/fetch/121679541/PFS-FIB-PRU000240-01_cobrafidcoords_JGunn_20171114.pdf", "2017-11-14", "The COBRA and FIDUCIAL Coordinates and Numbering Scheme"
"PFS-DRP-PRU030002-01", "2D DRP Plan", "Hassan Siddiqui", "", "2018-10-15", ""
"PFS-DRP-PRU030003-01", "2D DRP Plan Presentation Shanghai 2018", "Hassan Siddiqui", "", "2018-12-03", ""
"PFS-DRP-PRU060010-01", "PFS 2D Pipeline User Documentation Release 5.0", "Paul Price", "", "2019-01-29", ""
"PFS-DRP-PRU060011-01", "PFS 2D DRP Simulator User Documentation Release 5.0", "Paul Price", "", "2019-01-29", ""
"PFS-SPS-PRU000250-01", "SPECS for the IR Mangin Mirror and Thermal Rejection Coatings for the IR Arm of PFS", "Jim Gunn", "https://sumire.pbworks.com/w/file/132860079/PFS-SPS-PRU000250-01_mangincorrIR.190402.pdf", "2019-04-03", "SPECS for the IR Mangin Mirror and Thermal Rejection Coatings for the IR Arm of PFS"
"PFS-SPS-PRU000250-02", "SPECS for the IR Mangin Mirror and Thermal Rejection Coatings for the IR Arm of PFS", "Jim Gunn", "https://sumire.pbworks.com/w/file/132905301/PFS-SPS-PRU000250-02_mangincorrIR.190404v2.pdf", "2019-04-03", "SPECS for the IR Mangin Mirror and Thermal Rejection Coatings for the IR Arm of PFS"
"PFS-PFI-PRU101000-01", "PFI Operations at Subaru", "Robert Lupton", "", "2019-04-20", ""
